{"$schema":"http://json-schema.org/draft-07/schema#","title":"decision.v1","type":"object","additionalProperties":false,"required":["schema","work_id","attempt","content_digest","rule","inputs","outcome","decided_at"],"properties":{"schema":{"const":"decision.v1"},"work_id":{"type":"string","pattern":"^[0-9a-f]{64}$"},"attempt":{"type":"integer","minimum":1},"content_digest":{"type":"string","pattern":"^[0-9a-f]{64}$"},"rule":{"const":"any-evidenced-blocking->revise; all-seats-valid-and-no-blocking->accept; budget-exhausted->dead-letter"},"inputs":{"type":"object","additionalProperties":false,"required":["machine_verdict_digest","reviews"],"properties":{"machine_verdict_digest":{"type":"string","pattern":"^[0-9a-f]{64}$"},"reviews":{"type":"object","additionalProperties":false,"required":["correctness","value","falsification"],"properties":{"correctness":{"type":"string","pattern":"^[0-9a-f]{64}$"},"value":{"type":"string","pattern":"^[0-9a-f]{64}$"},"falsification":{"type":"string","pattern":"^[0-9a-f]{64}$"}}}}},"outcome":{"enum":["accept","revise","dead-letter"]},"decided_at":{"type":"string","pattern":"^\\d{4}-\\d{2}-\\d{2}T[^ ]+Z$","format":"date-time"}}}
