{"schema":"decision.v1","work_id":"aaaaaaaaaaaaaaaaaaaaaaaaaaaaaaaaaaaaaaaaaaaaaaaaaaaaaaaaaaaaaaaa","attempt":1,"content_digest":"bbbbbbbbbbbbbbbbbbbbbbbbbbbbbbbbbbbbbbbbbbbbbbbbbbbbbbbbbbbbbbbb","rule":"any-evidenced-blocking->revise; all-seats-valid-and-no-blocking->accept; budget-exhausted->dead-letter","inputs":{"machine_verdict_digest":"cccccccccccccccccccccccccccccccccccccccccccccccccccccccccccccccc","reviews":{"correctness":"cccccccccccccccccccccccccccccccccccccccccccccccccccccccccccccccc","value":"cccccccccccccccccccccccccccccccccccccccccccccccccccccccccccccccc","falsification":"cccccccccccccccccccccccccccccccccccccccccccccccccccccccccccccccc"}},"outcome":"accept","decided_at":"2026-01-01T00:00:00Z"}
